run,api_provider,status,tool_profile,context_profile,reasoning_effort,temperature,wall_seconds,cost_usd,total_tokens,cached_tokens,model_responses,read_file_calls,read_file_lines,read_file_overlapping_lines,context_compactions,forced_synthesis,working_score,notes
"DeepSeek V4 Pro","DeepSeek API","complete","generous","large","baseline","0.2",337,0.077426,720504,555648,15,23,4666,0,0,"no",6.8,"No overlap, no forced synthesis, better than previous DeepSeek runs but still had calibration issues."
"GPT-5.5","OpenAI API","complete","generous","large","low","omitted",83,0.688790,511384,432640,16,14,3606,0,0,"no",8.6,"Strongest large-context answer; zero overlap and concise tool loop, but higher cost than balanced-context GPT."
"GPT-5.5","OpenAI API","complete","generous","large","none","omitted",72,0.598835,534321,476160,22,14,2258,0,0,"no",8.1,"Useful and cheaper than low in this lane, but more response-chattery and slightly less crisp."
"GLM 5.1","OpenRouter","complete","generous","large","low","0.2",305,0.565768,713163,420672,13,17,3467,0,0,"no",7.1,"Much better than prior GLM low run; still slower and more spec-literal than GPT/Kimi."
"Kimi K2.6","OpenRouter","complete","generous","large","baseline","omitted",420,0.235501,543949,414590,16,20,3683,0,0,"no",7.7,"Strongest follow-up answer; provider route differs from direct Moonshot."
"Kimi K2.6","Moonshot API","complete","generous","large","baseline","omitted",172,0.255505,933634,825600,19,26,5509,0,0,"no",7.4,"Tier-upgrade rerun completed cleanly; faster than OpenRouter Kimi but the final was broader and less precise."
"Kimi K2.6","Moonshot API","aborted_429_tpd","generous","large","baseline","omitted",93,0.139169,396446,313088,12,28,4540,0,0,"n/a",,"Earlier direct Moonshot attempt hit organization TPD limit before final output."
